{
    "version": "1.0",
    "source": "Bren\u00e9 Brown - Atlas of the Heart (2021)",
    "metadata": {
        "total_emotions": 87,
        "categories": 13,
        "coordinate_system": "VAC (Valence, Arousal, Connection)",
        "vac_range": "[-1.0, 1.0] for each dimension",
        "created": "2026-01-03",
        "last_updated": "2026-01-03"
    },
    "emotions": [
        {
            "emotion_name": "Stress",
            "category": "When Things Are Uncertain or Too Much",
            "definition": "Physical and emotional tension from demands exceeding resources.",
            "vac": [-0.4, 0.6, -0.2],
            "haptic_pattern_id": "TENSE_PULSE"
        },
        {
            "emotion_name": "Overwhelm",
            "category": "When Things Are Uncertain or Too Much",
            "definition": "Extreme stress where demands completely exceed capacity.",
            "vac": [-0.6, 0.9, -0.3],
            "haptic_pattern_id": "HEAVY_THROB"
        },
        {
            "emotion_name": "Anxiety",
            "category": "When Things Are Uncertain or Too Much",
            "definition": "Future-focused fear and apprehension about potential threats.",
            "vac": [-0.5, 0.7, -0.4],
            "haptic_pattern_id": "RAPID_PULSE"
        },
        {
            "emotion_name": "Fear",
            "category": "When Things Are Uncertain or Too Much",
            "definition": "Immediate response to perceived threat or danger.",
            "vac": [-0.6, 0.8, -0.5],
            "haptic_pattern_id": "SHARP_STRIKE"
        },
        {
            "emotion_name": "Vulnerability",
            "category": "When Things Are Uncertain or Too Much",
            "definition": "The gateway to connection; risk exposure with uncertain outcome.",
            "vac": [0.0, 0.3, 0.6],
            "haptic_pattern_id": "GENTLE_PULSE"
        },
        {
            "emotion_name": "Worry",
            "category": "When Things Are Uncertain or Too Much",
            "definition": "Cognitive anxiety and rumination about potential problems.",
            "vac": [-0.4, 0.5, -0.3],
            "haptic_pattern_id": "TENSE_PULSE"
        },
        {
            "emotion_name": "Avoidance",
            "category": "When Things Are Uncertain or Too Much",
            "definition": "Evasion of discomfort or difficult situations.",
            "vac": [-0.3, -0.2, -0.4],
            "haptic_pattern_id": "TENSE_PULSE"
        },
        {
            "emotion_name": "Excitement",
            "category": "When Things Are Uncertain or Too Much",
            "definition": "Positive anticipation with high energy.",
            "vac": [0.7, 0.8, 0.4],
            "haptic_pattern_id": "LIGHT_PULSE"
        },
        {
            "emotion_name": "Dread",
            "category": "When Things Are Uncertain or Too Much",
            "definition": "Intense anxiety about an anticipated future event.",
            "vac": [-0.7, 0.6, -0.5],
            "haptic_pattern_id": "HEAVY_THROB"
        },
        {
            "emotion_name": "Admiration",
            "category": "When We Compare",
            "definition": "Respect and approval of someone without envy.",
            "vac": [0.6, 0.3, 0.5],
            "haptic_pattern_id": "WARM_PULSE"
        },
        {
            "emotion_name": "Envy",
            "category": "When We Compare",
            "definition": "Wanting what others have; longing for their advantages.",
            "vac": [-0.5, 0.4, -0.6],
            "haptic_pattern_id": "TENSE_PULSE"
        },
        {
            "emotion_name": "Jealousy",
            "category": "When We Compare",
            "definition": "Fear of losing what's yours to another person.",
            "vac": [-0.6, 0.7, -0.7],
            "haptic_pattern_id": "SHARP_STRIKE"
        },
        {
            "emotion_name": "Resentment",
            "category": "When We Compare",
            "definition": "Stored anger from perceived injustice or unfairness.",
            "vac": [-0.7, 0.5, -0.8],
            "haptic_pattern_id": "HEAVY_THROB"
        },
        {
            "emotion_name": "Schadenfreude",
            "category": "When We Compare",
            "definition": "Pleasure derived from another's misfortune.",
            "vac": [0.3, 0.4, -0.7],
            "haptic_pattern_id": "SHARP_STRIKE"
        },
        {
            "emotion_name": "Freudenfreude",
            "category": "When We Compare",
            "definition": "Joy at another person's success or happiness.",
            "vac": [0.8, 0.5, 0.9],
            "haptic_pattern_id": "LIGHT_PULSE"
        },
        {
            "emotion_name": "Reverence",
            "category": "When We Compare",
            "definition": "Deep respect and awe for someone or something.",
            "vac": [0.7, 0.2, 0.8],
            "haptic_pattern_id": "GENTLE_PULSE"
        },
        {
            "emotion_name": "Disappointment",
            "category": "When Things Don't Go As Planned",
            "definition": "Sadness or displeasure caused by unmet expectations.",
            "vac": [-0.5, -0.3, 0.0],
            "haptic_pattern_id": "HEAVY_THROB"
        },
        {
            "emotion_name": "Regret",
            "category": "When Things Don't Go As Planned",
            "definition": "Sorrow about past actions or decisions.",
            "vac": [-0.6, -0.2, -0.3],
            "haptic_pattern_id": "HEAVY_THROB"
        },
        {
            "emotion_name": "Frustration",
            "category": "When Things Don't Go As Planned",
            "definition": "High energy response to blocked goals.",
            "vac": [-0.5, 0.7, -0.2],
            "haptic_pattern_id": "SHARP_STRIKE"
        },
        {
            "emotion_name": "Boredom",
            "category": "When Things Don't Go As Planned",
            "definition": "Lack of stimulation or interest.",
            "vac": [-0.2, -0.8, -0.2],
            "haptic_pattern_id": "HEAVY_THROB"
        },
        {
            "emotion_name": "Discouragement",
            "category": "When Things Don't Go As Planned",
            "definition": "Loss of confidence or enthusiasm.",
            "vac": [-0.5, -0.4, -0.2],
            "haptic_pattern_id": "HEAVY_THROB"
        },
        {
            "emotion_name": "Resignation",
            "category": "When Things Don't Go As Planned",
            "definition": "Acceptance of an undesired outcome without resistance.",
            "vac": [-0.6, -0.6, -0.5],
            "haptic_pattern_id": "HEAVY_THROB"
        },
        {
            "emotion_name": "Awe",
            "category": "When It's Beyond Us",
            "definition": "Overwhelmed by greatness or beauty; sense of vastness.",
            "vac": [0.7, 0.5, 0.8],
            "haptic_pattern_id": "GENTLE_PULSE"
        },
        {
            "emotion_name": "Wonder",
            "category": "When It's Beyond Us",
            "definition": "Curiosity and amazement at something extraordinary.",
            "vac": [0.6, 0.4, 0.7],
            "haptic_pattern_id": "LIGHT_PULSE"
        },
        {
            "emotion_name": "Confusion",
            "category": "When It's Beyond Us",
            "definition": "Lack of understanding or clarity.",
            "vac": [-0.2, 0.3, -0.2],
            "haptic_pattern_id": "RAPID_PULSE"
        },
        {
            "emotion_name": "Curiosity",
            "category": "When It's Beyond Us",
            "definition": "Drive to explore, learn, and understand.",
            "vac": [0.5, 0.6, 0.3],
            "haptic_pattern_id": "LIGHT_PULSE"
        },
        {
            "emotion_name": "Surprise",
            "category": "When It's Beyond Us",
            "definition": "Unexpected occurrence that interrupts normal flow.",
            "vac": [0.0, 0.8, 0.0],
            "haptic_pattern_id": "SHARP_STRIKE"
        },
        {
            "emotion_name": "Interest",
            "category": "When It's Beyond Us",
            "definition": "Attention and engagement with something novel.",
            "vac": [0.4, 0.5, 0.2],
            "haptic_pattern_id": "LIGHT_PULSE"
        },
        {
            "emotion_name": "Bittersweetness",
            "category": "When Things Aren't What They Seem",
            "definition": "Simultaneous happiness and sadness in the same moment.",
            "vac": [0.0, -0.2, 0.5],
            "haptic_pattern_id": "GENTLE_PULSE"
        },
        {
            "emotion_name": "Nostalgia",
            "category": "When Things Aren't What They Seem",
            "definition": "Sentimental longing for the past.",
            "vac": [0.3, -0.2, 0.4],
            "haptic_pattern_id": "WARM_PULSE"
        },
        {
            "emotion_name": "Amusement",
            "category": "When Things Aren't What They Seem",
            "definition": "Light-hearted enjoyment and entertainment.",
            "vac": [0.6, 0.4, 0.3],
            "haptic_pattern_id": "LIGHT_PULSE"
        },
        {
            "emotion_name": "Cognitive Dissonance",
            "category": "When Things Aren't What They Seem",
            "definition": "Mental discomfort from holding conflicting beliefs.",
            "vac": [-0.4, 0.5, -0.3],
            "haptic_pattern_id": "TENSE_PULSE"
        },
        {
            "emotion_name": "Irony",
            "category": "When Things Aren't What They Seem",
            "definition": "Incongruity between expectation and reality.",
            "vac": [0.2, 0.2, 0.0],
            "haptic_pattern_id": "LIGHT_PULSE"
        },
        {
            "emotion_name": "Sarcasm",
            "category": "When Things Aren't What They Seem",
            "definition": "Mocking or contemptuous irony.",
            "vac": [0.0, 0.3, -0.2],
            "haptic_pattern_id": "SHARP_STRIKE"
        },
        {
            "emotion_name": "Anguish",
            "category": "When We're Hurting",